{
  "$schema": "https://json-schema.org/draft/2020-12/schema",
  "$id": "https://morphoia.org/schemas/engine/ir-replay/0.1.0",
  "title": "Morphoia Engine IR replay manifest 0.1.0",
  "description": "Deterministic replay recipe for a public Engine IR manifest. It carries references and expected identities, never payload bytes.",
  "type": "object",
  "required": [
    "format",
    "format_version",
    "canonical_profile",
    "manifest",
    "expected_content_identity",
    "operations",
    "determinism"
  ],
  "properties": {
    "format": {"const": "morphoia.engine.ir-replay"},
    "format_version": {"const": "0.1.0"},
    "canonical_profile": {"const": "morphoia.canonical-json.profile1"},
    "manifest": {"$ref": "#/$defs/manifestReference"},
    "expected_content_identity": {"$ref": "#/$defs/sha256"},
    "operations": {
      "type": "array",
      "minItems": 5,
      "maxItems": 5,
      "prefixItems": [
        {"$ref": "#/$defs/lexicalStep"},
        {"$ref": "#/$defs/schemaStep"},
        {"$ref": "#/$defs/semanticStep"},
        {"$ref": "#/$defs/canonicalStep"},
        {"$ref": "#/$defs/identityStep"}
      ],
      "items": false
    },
    "determinism": {
      "type": "object",
      "required": ["seed", "expected_runs"],
      "properties": {
        "seed": {"type": "integer", "minimum": -9007199254740991, "maximum": 9007199254740991},
        "expected_runs": {"type": "integer", "minimum": 2, "maximum": 64}
      },
      "additionalProperties": false
    },
    "extensions": {
      "type": "object",
      "maxProperties": 32,
      "propertyNames": {
        "pattern": "^(?:[a-z][a-z0-9]*(?:-[a-z0-9]+)*\\.)+[a-z][a-z0-9]*(?:-[a-z0-9]+)*$"
      },
      "additionalProperties": {"$ref": "#/$defs/jsonValue"}
    }
  },
  "additionalProperties": false,
  "$defs": {
    "sha256": {"type": "string", "pattern": "^[0-9a-f]{64}$"},
    "mediaType": {
      "type": "string",
      "pattern": "^[a-z0-9][a-z0-9!#$&^_.+-]*/[a-z0-9][a-z0-9!#$&^_.+-]*$",
      "maxLength": 127
    },
    "manifestReference": {
      "type": "object",
      "required": ["uri", "sha256", "size_bytes", "media_type"],
      "properties": {
        "uri": {"type": "string", "pattern": "^morphoia-cas://sha256/[0-9a-f]{64}$"},
        "sha256": {"$ref": "#/$defs/sha256"},
        "size_bytes": {"type": "integer", "minimum": 0, "maximum": 9007199254740991},
        "media_type": {"const": "application/vnd.morphoia.ir-manifest.v0+json"}
      },
      "additionalProperties": false
    },
    "lexicalStep": {
      "type": "object",
      "required": ["sequence", "operation"],
      "properties": {"sequence": {"const": 1}, "operation": {"const": "validate-lexical"}},
      "additionalProperties": false
    },
    "schemaStep": {
      "type": "object",
      "required": ["sequence", "operation"],
      "properties": {"sequence": {"const": 2}, "operation": {"const": "validate-schema"}},
      "additionalProperties": false
    },
    "semanticStep": {
      "type": "object",
      "required": ["sequence", "operation"],
      "properties": {"sequence": {"const": 3}, "operation": {"const": "validate-semantic"}},
      "additionalProperties": false
    },
    "canonicalStep": {
      "type": "object",
      "required": ["sequence", "operation"],
      "properties": {"sequence": {"const": 4}, "operation": {"const": "canonicalize-content"}},
      "additionalProperties": false
    },
    "identityStep": {
      "type": "object",
      "required": ["sequence", "operation"],
      "properties": {"sequence": {"const": 5}, "operation": {"const": "verify-identity"}},
      "additionalProperties": false
    },
    "jsonValue": {
      "oneOf": [
        {"type": "null"},
        {"type": "boolean"},
        {"type": "string", "maxLength": 4096},
        {"type": "integer", "minimum": -9007199254740991, "maximum": 9007199254740991},
        {"type": "array", "maxItems": 256, "items": {"$ref": "#/$defs/jsonValue"}},
        {"type": "object", "maxProperties": 128, "additionalProperties": {"$ref": "#/$defs/jsonValue"}}
      ]
    }
  }
}
