{
  "format": "morphoia.engine.ir-replay",
  "format_version": "0.1.0",
  "canonical_profile": "morphoia.canonical-json.profile1",
  "manifest": {
    "uri": "morphoia-cas://sha256/93727dba35a04dc3337b04454928b6a4e132094290d963402128cc48a3208754",
    "sha256": "93727dba35a04dc3337b04454928b6a4e132094290d963402128cc48a3208754",
    "size_bytes": 6322,
    "media_type": "application/vnd.morphoia.ir-manifest.v0+json"
  },
  "expected_content_identity": "2fa985245e26f4033a91054efab014349e8369ce578e3cab01cd233c2b6d85f5",
  "operations": [
    {
      "sequence": 1,
      "operation": "validate-lexical"
    },
    {
      "sequence": 2,
      "operation": "validate-schema"
    },
    {
      "sequence": 3,
      "operation": "validate-semantic"
    },
    {
      "sequence": 4,
      "operation": "canonicalize-content"
    },
    {
      "sequence": 5,
      "operation": "verify-identity"
    }
  ],
  "determinism": {
    "seed": 5,
    "expected_runs": 2
  }
}
