{
  "format": "morphoia.engine.ir-replay",
  "format_version": "0.1.0",
  "canonical_profile": "morphoia.canonical-json.profile1",
  "manifest": {
    "uri": "morphoia-cas://sha256/df695af27f285ac21c774c2cb144a50d569fd0ed9b70120f6d66a8e0588e0db6",
    "sha256": "df695af27f285ac21c774c2cb144a50d569fd0ed9b70120f6d66a8e0588e0db6",
    "size_bytes": 5207,
    "media_type": "application/vnd.morphoia.ir-manifest.v0+json"
  },
  "expected_content_identity": "4858985aa91f13367ff9e8980b3c846f302a2f99b6ea30c7557d5aba85cc0b69",
  "operations": [
    {
      "sequence": 1,
      "operation": "validate-lexical"
    },
    {
      "sequence": 2,
      "operation": "validate-schema"
    },
    {
      "sequence": 3,
      "operation": "validate-semantic"
    },
    {
      "sequence": 4,
      "operation": "canonicalize-content"
    },
    {
      "sequence": 5,
      "operation": "verify-identity"
    }
  ],
  "determinism": {
    "seed": 12,
    "expected_runs": 2
  }
}
