{
  "format": "morphoia.engine.ir-replay",
  "format_version": "0.1.0",
  "canonical_profile": "morphoia.canonical-json.profile1",
  "manifest": {
    "uri": "morphoia-cas://sha256/860d3bfbcd14e1a611057057e20ac202d69101fb0bb68227874a3c4487745816",
    "sha256": "860d3bfbcd14e1a611057057e20ac202d69101fb0bb68227874a3c4487745816",
    "size_bytes": 4782,
    "media_type": "application/vnd.morphoia.ir-manifest.v0+json"
  },
  "expected_content_identity": "093583023baae72965fc67a98be4b59bc7531f87dc22960343cc73c78b725f55",
  "operations": [
    {
      "sequence": 1,
      "operation": "validate-lexical"
    },
    {
      "sequence": 2,
      "operation": "validate-schema"
    },
    {
      "sequence": 3,
      "operation": "validate-semantic"
    },
    {
      "sequence": 4,
      "operation": "canonicalize-content"
    },
    {
      "sequence": 5,
      "operation": "verify-identity"
    }
  ],
  "determinism": {
    "seed": 1,
    "expected_runs": 2
  }
}
