{
  "format": "morphoia.engine.ir-replay",
  "format_version": "0.1.0",
  "canonical_profile": "morphoia.canonical-json.profile1",
  "manifest": {
    "uri": "morphoia-cas://sha256/05ae1b2d76236d1047704687ba77d7250af692d479dc0f8c3f56ed6ab27a6238",
    "sha256": "05ae1b2d76236d1047704687ba77d7250af692d479dc0f8c3f56ed6ab27a6238",
    "size_bytes": 6324,
    "media_type": "application/vnd.morphoia.ir-manifest.v0+json"
  },
  "expected_content_identity": "ffddd3324dbef191ee05732a742881a84eff7e637e05f077ddcb8b086e3cfb20",
  "operations": [
    {
      "sequence": 1,
      "operation": "validate-lexical"
    },
    {
      "sequence": 2,
      "operation": "validate-schema"
    },
    {
      "sequence": 3,
      "operation": "validate-semantic"
    },
    {
      "sequence": 4,
      "operation": "canonicalize-content"
    },
    {
      "sequence": 5,
      "operation": "verify-identity"
    }
  ],
  "determinism": {
    "seed": 8,
    "expected_runs": 2
  }
}
