{
  "format": "morphoia.engine.ir-replay",
  "format_version": "0.1.0",
  "canonical_profile": "morphoia.canonical-json.profile1",
  "manifest": {
    "uri": "morphoia-cas://sha256/79cdc135df2a86af0657ae2ea9930af62dbf15f78f2d5b52bcc13105efb58e43",
    "sha256": "79cdc135df2a86af0657ae2ea9930af62dbf15f78f2d5b52bcc13105efb58e43",
    "size_bytes": 4982,
    "media_type": "application/vnd.morphoia.ir-manifest.v0+json"
  },
  "expected_content_identity": "e2869c264d27c0e6b398d678901e87351ddc67c2b58af80621fa1a0a80285471",
  "operations": [
    {
      "sequence": 1,
      "operation": "validate-lexical"
    },
    {
      "sequence": 2,
      "operation": "validate-schema"
    },
    {
      "sequence": 3,
      "operation": "validate-semantic"
    },
    {
      "sequence": 4,
      "operation": "canonicalize-content"
    },
    {
      "sequence": 5,
      "operation": "verify-identity"
    }
  ],
  "determinism": {
    "seed": 20,
    "expected_runs": 2
  }
}
