{
  "format": "morphoia.engine.ir-replay",
  "format_version": "0.1.0",
  "canonical_profile": "morphoia.canonical-json.profile1",
  "manifest": {
    "uri": "morphoia-cas://sha256/031a1889c94f05e864d609727a193f04ae92af56828aac89acb8d52a8af5a837",
    "sha256": "031a1889c94f05e864d609727a193f04ae92af56828aac89acb8d52a8af5a837",
    "size_bytes": 4792,
    "media_type": "application/vnd.morphoia.ir-manifest.v0+json"
  },
  "expected_content_identity": "066e832c338b0be112bb722f656d7972bd03317e94938d80b94c9283f9220e1c",
  "operations": [
    {
      "sequence": 1,
      "operation": "validate-lexical"
    },
    {
      "sequence": 2,
      "operation": "validate-schema"
    },
    {
      "sequence": 3,
      "operation": "validate-semantic"
    },
    {
      "sequence": 4,
      "operation": "canonicalize-content"
    },
    {
      "sequence": 5,
      "operation": "verify-identity"
    }
  ],
  "determinism": {
    "seed": 3,
    "expected_runs": 2
  }
}
