{
  "format": "morphoia.engine.ir-replay",
  "format_version": "0.1.0",
  "canonical_profile": "morphoia.canonical-json.profile1",
  "manifest": {
    "uri": "morphoia-cas://sha256/da91ec4f0d916a1dbef48df7a4ebc7383a39fcafd3f7dd137dbc835c28d95a51",
    "sha256": "da91ec4f0d916a1dbef48df7a4ebc7383a39fcafd3f7dd137dbc835c28d95a51",
    "size_bytes": 5115,
    "media_type": "application/vnd.morphoia.ir-manifest.v0+json"
  },
  "expected_content_identity": "85a2b04da64ef7dbd828b6daa928edc8b785f47791aca132bd156ce9d606c137",
  "operations": [
    {
      "sequence": 1,
      "operation": "validate-lexical"
    },
    {
      "sequence": 2,
      "operation": "validate-schema"
    },
    {
      "sequence": 3,
      "operation": "validate-semantic"
    },
    {
      "sequence": 4,
      "operation": "canonicalize-content"
    },
    {
      "sequence": 5,
      "operation": "verify-identity"
    }
  ],
  "determinism": {
    "seed": 14,
    "expected_runs": 2
  }
}
