{
  "format": "morphoia.engine.ir-replay",
  "format_version": "0.1.0",
  "canonical_profile": "morphoia.canonical-json.profile1",
  "manifest": {
    "uri": "morphoia-cas://sha256/4b97174c65c373fda0bef116f0a0b6490ea579b4730454b58bbb75cdc0857334",
    "sha256": "4b97174c65c373fda0bef116f0a0b6490ea579b4730454b58bbb75cdc0857334",
    "size_bytes": 4807,
    "media_type": "application/vnd.morphoia.ir-manifest.v0+json"
  },
  "expected_content_identity": "6d7abaf907569e81545b1c306f5a8dc69515d25cdfbe1f4416ca5498ee00c68d",
  "operations": [
    {
      "sequence": 1,
      "operation": "validate-lexical"
    },
    {
      "sequence": 2,
      "operation": "validate-schema"
    },
    {
      "sequence": 3,
      "operation": "validate-semantic"
    },
    {
      "sequence": 4,
      "operation": "canonicalize-content"
    },
    {
      "sequence": 5,
      "operation": "verify-identity"
    }
  ],
  "determinism": {
    "seed": 2,
    "expected_runs": 2
  }
}
